[
  {
    "id": "sample-hvac-nashville-001",
    "business_name": "Example Comfort HVAC",
    "industry": "HVAC",
    "category": "emergency service",
    "phone": "+10000000001",
    "website": "https://example.invalid/hvac",
    "city": "Nashville",
    "state": "TN",
    "source_url": "https://example.invalid/hvac-source",
    "hours_signal": "Public site lists weekday hours and emergency service language.",
    "emergency_signal": "AC outage and after-hours repair copy.",
    "missed_call_risk_notes": "Fake sample: public call path appears to rely on voicemail after hours.",
    "current_answering_path": "voicemail-after-hours",
    "service_area_notes": "Metro residential service area.",
    "review_signal": "Fake sample: reviews mention slow callbacks during peak heat.",
    "ad_spend_signal": "Fake sample: visible sponsored listing.",
    "contact_person": "Example Owner",
    "contact_role": "Owner",
    "email_if_public": "owner@example.invalid",
    "proof_angle": "missed-call cost education and safe demo preview",
    "outreach_angle": "AC outage after 6pm may go to voicemail.",
    "objection_prediction": "We answer our own calls.",
    "score": null,
    "score_category": null,
    "next_action": "prepare Wallace call sheet",
    "owner": "Wallace",
    "status": "ready",
    "compliance_notes": "Fake sample only. Email draft review required. No SMS.",
    "last_touch": null,
    "next_touch": "manual Wallace review",
    "created_at": "2026-05-14",
    "updated_at": "2026-05-14",
    "signals": {
      "owner_reachable": true,
      "service_area_business": true,
      "right_size": true,
      "emergency_service": true,
      "after_hours_need": true,
      "seasonal_spike": true,
      "website_contact_friction": true,
      "review_pain": true,
      "call_path_issue": true,
      "high_value_call": true,
      "ad_spend_visible": true,
      "strong_reviews": true,
      "multiple_crews_or_locations": true,
      "public_phone_works": true,
      "public_email_or_form": true,
      "social_active": true,
      "local_or_strategic_market": true,
      "clear_proof_angle": true,
      "safe_secret_shopper_angle": true,
      "demo_preview_fit": true,
      "fits_after_hours_capture": true,
      "fits_revenue_recovery": true,
      "fits_operational_infrastructure": true,
      "deductions": {
        "national_franchise": false,
        "strong_existing_solution": false,
        "missing_sources": false,
        "sensitive_category": false,
        "terms_risk": false,
        "sms_compliance_uncertain": true
      }
    }
  },
  {
    "id": "sample-plumbing-austin-001",
    "business_name": "Example Rapid Plumbing",
    "industry": "plumbing",
    "category": "emergency service",
    "phone": "+10000000002",
    "website": "https://example.invalid/plumbing",
    "city": "Austin",
    "state": "TX",
    "source_url": "https://example.invalid/plumbing-source",
    "hours_signal": "Emergency service promoted but after-hours instructions are unclear.",
    "emergency_signal": "Burst pipe, leak, and water heater emergency copy.",
    "missed_call_risk_notes": "Fake sample: urgent callers may not get a clear next step.",
    "current_answering_path": "unclear-after-hours",
    "service_area_notes": "Residential plumbing in several suburbs.",
    "review_signal": "Fake sample: one review mentions waiting for a callback.",
    "ad_spend_signal": "Fake sample: local service landing page.",
    "contact_person": "Sample Manager",
    "contact_role": "Operations Manager",
    "email_if_public": "service@example.invalid",
    "proof_angle": "secret-shopper call-path finding",
    "outreach_angle": "After-hours emergency calls need a clear first response.",
    "objection_prediction": "We already have an emergency line.",
    "score": null,
    "score_category": null,
    "next_action": "manual call-path review",
    "owner": "Wallace",
    "status": "ready",
    "compliance_notes": "Fake sample only. Phone review only; no automated contact.",
    "last_touch": null,
    "next_touch": "manual Wallace review",
    "created_at": "2026-05-14",
    "updated_at": "2026-05-14",
    "signals": {
      "owner_reachable": true,
      "service_area_business": true,
      "right_size": true,
      "emergency_service": true,
      "after_hours_need": true,
      "seasonal_spike": true,
      "website_contact_friction": true,
      "review_pain": true,
      "call_path_issue": true,
      "high_value_call": true,
      "ad_spend_visible": true,
      "strong_reviews": true,
      "multiple_crews_or_locations": false,
      "public_phone_works": true,
      "public_email_or_form": true,
      "social_active": false,
      "local_or_strategic_market": true,
      "clear_proof_angle": true,
      "safe_secret_shopper_angle": true,
      "demo_preview_fit": true,
      "fits_after_hours_capture": true,
      "fits_revenue_recovery": true,
      "fits_operational_infrastructure": true,
      "deductions": {
        "national_franchise": false,
        "strong_existing_solution": false,
        "missing_sources": false,
        "sensitive_category": false,
        "terms_risk": false,
        "sms_compliance_uncertain": true
      }
    }
  },
  {
    "id": "sample-roofing-denver-001",
    "business_name": "Example Peak Roofing",
    "industry": "roofing",
    "category": "storm response",
    "phone": "+10000000003",
    "website": "https://example.invalid/roofing",
    "city": "Denver",
    "state": "CO",
    "source_url": "https://example.invalid/roofing-source",
    "hours_signal": "Office hours listed; storm inspection CTA visible.",
    "emergency_signal": "Storm damage and emergency tarp copy.",
    "missed_call_risk_notes": "Fake sample: storm lead capture likely time-sensitive.",
    "current_answering_path": "office-hours-only",
    "service_area_notes": "Roof replacement and storm repair.",
    "review_signal": "Fake sample: strong reviews, no clear phone complaint.",
    "ad_spend_signal": "Fake sample: storm landing page suggests paid demand.",
    "contact_person": "Unknown",
    "contact_role": "Not found",
    "email_if_public": "info@example.invalid",
    "proof_angle": "reviewed handoff process",
    "outreach_angle": "Storm calls need fast capture and handoff.",
    "objection_prediction": "Storms are seasonal.",
    "score": null,
    "score_category": null,
    "next_action": "send sequence after owner research",
    "owner": "system",
    "status": "research",
    "compliance_notes": "Fake sample only. Research owner before outreach.",
    "last_touch": null,
    "next_touch": "research owner",
    "created_at": "2026-05-14",
    "updated_at": "2026-05-14",
    "signals": {
      "owner_reachable": false,
      "service_area_business": true,
      "right_size": true,
      "emergency_service": true,
      "after_hours_need": true,
      "seasonal_spike": true,
      "website_contact_friction": false,
      "review_pain": false,
      "call_path_issue": false,
      "high_value_call": true,
      "ad_spend_visible": true,
      "strong_reviews": true,
      "multiple_crews_or_locations": true,
      "public_phone_works": true,
      "public_email_or_form": true,
      "social_active": true,
      "local_or_strategic_market": true,
      "clear_proof_angle": true,
      "safe_secret_shopper_angle": false,
      "demo_preview_fit": true,
      "fits_after_hours_capture": true,
      "fits_revenue_recovery": true,
      "fits_operational_infrastructure": false,
      "deductions": {
        "national_franchise": false,
        "strong_existing_solution": false,
        "missing_sources": false,
        "sensitive_category": false,
        "terms_risk": false,
        "sms_compliance_uncertain": true
      }
    }
  },
  {
    "id": "sample-water-damage-atlanta-001",
    "business_name": "Example Flood Response",
    "industry": "water damage",
    "category": "emergency restoration",
    "phone": "+10000000004",
    "website": "https://example.invalid/water-damage",
    "city": "Atlanta",
    "state": "GA",
    "source_url": "https://example.invalid/water-damage-source",
    "hours_signal": "Claims 24-hour emergency response.",
    "emergency_signal": "Flooding and mitigation language.",
    "missed_call_risk_notes": "Fake sample: high-value urgent calls need intake clarity.",
    "current_answering_path": "unknown",
    "service_area_notes": "Metro restoration service area.",
    "review_signal": "Fake sample: reviews reward fast response.",
    "ad_spend_signal": "Fake sample: multiple emergency landing pages.",
    "contact_person": "Example Dispatch Lead",
    "contact_role": "Dispatch Lead",
    "email_if_public": "dispatch@example.invalid",
    "proof_angle": "emergency intake framework",
    "outreach_angle": "Flood calls cannot wait for voicemail.",
    "objection_prediction": "We already have dispatch.",
    "score": null,
    "score_category": null,
    "next_action": "prepare Wallace call sheet",
    "owner": "Wallace",
    "status": "ready",
    "compliance_notes": "Fake sample only. No claims about dispatch integration.",
    "last_touch": null,
    "next_touch": "manual Wallace review",
    "created_at": "2026-05-14",
    "updated_at": "2026-05-14",
    "signals": {
      "owner_reachable": true,
      "service_area_business": true,
      "right_size": true,
      "emergency_service": true,
      "after_hours_need": true,
      "seasonal_spike": true,
      "website_contact_friction": false,
      "review_pain": false,
      "call_path_issue": false,
      "high_value_call": true,
      "ad_spend_visible": true,
      "strong_reviews": true,
      "multiple_crews_or_locations": true,
      "public_phone_works": true,
      "public_email_or_form": true,
      "social_active": false,
      "local_or_strategic_market": true,
      "clear_proof_angle": true,
      "safe_secret_shopper_angle": false,
      "demo_preview_fit": true,
      "fits_after_hours_capture": true,